{
  "schema_version": "1.0.0",
  "manifest_id": "p0",
  "status": "provisional",
  "completeness_claimed": false,
  "entries": [
    {
      "parity_id": "p0.project.file.open-existing",
      "taxonomy": "active-parity",
      "provisional": true,
      "provenance": {
        "source_urls": [
          "https://texspark.io/features/"
        ],
        "observed_date": "2026-08-30",
        "method": "public-web",
        "status": "provisional"
      },
      "disposition": "planned",
      "planned_evidence": [
        {
          "category": "linux-integration",
          "phase": "linux-p0",
          "artifact_kind": "portable contract, fixture, or integration receipt",
          "environment": "canonical-linux",
          "status": "planned"
        }
      ]
    },
    {
      "parity_id": "p0.project.file.create-save",
      "taxonomy": "active-parity",
      "provisional": true,
      "provenance": {
        "source_urls": [
          "https://texspark.io/documentation/"
        ],
        "observed_date": "2026-08-30",
        "method": "public-web",
        "status": "provisional"
      },
      "disposition": "planned",
      "planned_evidence": [
        {
          "category": "linux-integration",
          "phase": "linux-p0",
          "artifact_kind": "portable contract, fixture, or integration receipt",
          "environment": "canonical-linux",
          "status": "planned"
        }
      ]
    },
    {
      "parity_id": "p0.project.file.tabs-session",
      "taxonomy": "active-parity",
      "provisional": true,
      "provenance": {
        "source_urls": [
          "https://texspark.io/features/",
          "https://texspark.io/legal/"
        ],
        "observed_date": "2026-08-30",
        "method": "public-web",
        "status": "provisional"
      },
      "disposition": "planned",
      "planned_evidence": [
        {
          "category": "linux-integration",
          "phase": "linux-p0",
          "artifact_kind": "portable contract, fixture, or integration receipt",
          "environment": "canonical-linux",
          "status": "planned"
        }
      ]
    },
    {
      "parity_id": "p0.project.build-target.persistence",
      "taxonomy": "active-parity",
      "provisional": true,
      "provenance": {
        "source_urls": [
          "https://texspark.io/features/"
        ],
        "observed_date": "2026-08-30",
        "method": "public-web",
        "status": "provisional"
      },
      "disposition": "planned",
      "planned_evidence": [
        {
          "category": "linux-integration",
          "phase": "linux-p0",
          "artifact_kind": "portable contract, fixture, or integration receipt",
          "environment": "canonical-linux",
          "status": "planned"
        }
      ]
    },
    {
      "parity_id": "p0.project.includes.recursive-outline",
      "taxonomy": "active-parity",
      "provisional": true,
      "provenance": {
        "source_urls": [
          "https://texspark.io/features/"
        ],
        "observed_date": "2026-08-30",
        "method": "public-web",
        "status": "provisional"
      },
      "disposition": "planned",
      "planned_evidence": [
        {
          "category": "linux-integration",
          "phase": "linux-p0",
          "artifact_kind": "portable contract, fixture, or integration receipt",
          "environment": "canonical-linux",
          "status": "planned"
        }
      ]
    },
    {
      "parity_id": "p0.project.external-change.diff-resolution",
      "taxonomy": "active-parity",
      "provisional": true,
      "provenance": {
        "source_urls": [
          "https://texspark.io/2026/08/28/v0-10-2-outline/"
        ],
        "observed_date": "2026-08-30",
        "method": "public-web",
        "status": "provisional"
      },
      "disposition": "planned",
      "planned_evidence": [
        {
          "category": "linux-integration",
          "phase": "linux-p0",
          "artifact_kind": "portable contract, fixture, or integration receipt",
          "environment": "canonical-linux",
          "status": "planned"
        }
      ]
    },
    {
      "parity_id": "p0.editor.native.text-input",
      "taxonomy": "active-parity",
      "provisional": true,
      "provenance": {
        "source_urls": [
          "https://texspark.io/features/"
        ],
        "observed_date": "2026-08-30",
        "method": "public-web",
        "status": "provisional"
      },
      "disposition": "planned",
      "planned_evidence": [
        {
          "category": "linux-portable-contract",
          "phase": "linux-p0",
          "artifact_kind": "portable contract, fixture, or integration receipt",
          "environment": "canonical-linux",
          "status": "planned"
        },
        {
          "category": "final-mac-native",
          "phase": "final-mac-e2e",
          "artifact_kind": "TextKit physical interaction receipt",
          "environment": "physical-mac-latest",
          "status": "planned"
        }
      ]
    },
    {
      "parity_id": "p0.editor.editing.undo-find-replace",
      "taxonomy": "active-parity",
      "provisional": true,
      "provenance": {
        "source_urls": [
          "https://texspark.io/documentation/"
        ],
        "observed_date": "2026-08-30",
        "method": "public-web",
        "status": "provisional"
      },
      "disposition": "planned",
      "planned_evidence": [
        {
          "category": "linux-portable-contract",
          "phase": "linux-p0",
          "artifact_kind": "portable contract, fixture, or integration receipt",
          "environment": "canonical-linux",
          "status": "planned"
        },
        {
          "category": "final-mac-native",
          "phase": "final-mac-e2e",
          "artifact_kind": "TextKit physical interaction receipt",
          "environment": "physical-mac-latest",
          "status": "planned"
        }
      ]
    },
    {
      "parity_id": "p0.editor.language.latex-highlighting",
      "taxonomy": "active-parity",
      "provisional": true,
      "provenance": {
        "source_urls": [
          "https://texspark.io/features/"
        ],
        "observed_date": "2026-08-30",
        "method": "public-web",
        "status": "provisional"
      },
      "disposition": "planned",
      "planned_evidence": [
        {
          "category": "linux-portable-contract",
          "phase": "linux-p0",
          "artifact_kind": "portable contract, fixture, or integration receipt",
          "environment": "canonical-linux",
          "status": "planned"
        }
      ]
    },
    {
      "parity_id": "p0.editor.language.bibtex-highlighting",
      "taxonomy": "active-parity",
      "provisional": true,
      "provenance": {
        "source_urls": [
          "https://texspark.io/features/"
        ],
        "observed_date": "2026-08-30",
        "method": "public-web",
        "status": "provisional"
      },
      "disposition": "planned",
      "planned_evidence": [
        {
          "category": "linux-portable-contract",
          "phase": "linux-p0",
          "artifact_kind": "portable contract, fixture, or integration receipt",
          "environment": "canonical-linux",
          "status": "planned"
        }
      ]
    },
    {
      "parity_id": "p0.editor.intelligence.command-completion",
      "taxonomy": "active-parity",
      "provisional": true,
      "provenance": {
        "source_urls": [
          "https://texspark.io/features/"
        ],
        "observed_date": "2026-08-30",
        "method": "public-web",
        "status": "provisional"
      },
      "disposition": "planned",
      "planned_evidence": [
        {
          "category": "linux-portable-contract",
          "phase": "linux-p0",
          "artifact_kind": "portable contract, fixture, or integration receipt",
          "environment": "canonical-linux",
          "status": "planned"
        }
      ]
    },
    {
      "parity_id": "p0.editor.intelligence.cross-file-symbols",
      "taxonomy": "active-parity",
      "provisional": true,
      "provenance": {
        "source_urls": [
          "https://texspark.io/features/"
        ],
        "observed_date": "2026-08-30",
        "method": "public-web",
        "status": "provisional"
      },
      "disposition": "planned",
      "planned_evidence": [
        {
          "category": "linux-portable-contract",
          "phase": "linux-p0",
          "artifact_kind": "portable contract, fixture, or integration receipt",
          "environment": "canonical-linux",
          "status": "planned"
        }
      ]
    },
    {
      "parity_id": "p0.editor.intelligence.folding-matching",
      "taxonomy": "active-parity",
      "provisional": true,
      "provenance": {
        "source_urls": [
          "https://texspark.io/features/"
        ],
        "observed_date": "2026-08-30",
        "method": "public-web",
        "status": "provisional"
      },
      "disposition": "planned",
      "planned_evidence": [
        {
          "category": "linux-portable-contract",
          "phase": "linux-p0",
          "artifact_kind": "portable contract, fixture, or integration receipt",
          "environment": "canonical-linux",
          "status": "planned"
        }
      ]
    },
    {
      "parity_id": "p0.editor.navigation.minimap",
      "taxonomy": "active-parity",
      "provisional": true,
      "provenance": {
        "source_urls": [
          "https://texspark.io/features/"
        ],
        "observed_date": "2026-08-30",
        "method": "public-web",
        "status": "provisional"
      },
      "disposition": "planned",
      "planned_evidence": [
        {
          "category": "linux-portable-contract",
          "phase": "linux-p0",
          "artifact_kind": "portable contract, fixture, or integration receipt",
          "environment": "canonical-linux",
          "status": "planned"
        }
      ]
    },